{
  "schemaVersion": 1,
  "id": "synthetic-example-do-not-publish",
  "runKind": "protocol-validation",
  "commit": "0000000000000000000000000000000000000000",
  "workload": {
    "id": "repository-audit-v1",
    "scheduledSteps": 30,
    "scheduledStepIds": [
      "setup",
      "round-1",
      "round-2",
      "round-3",
      "round-4",
      "round-5",
      "round-6",
      "round-7",
      "round-8",
      "round-9",
      "round-10",
      "round-11",
      "round-12",
      "round-13",
      "round-14",
      "round-15",
      "round-16",
      "round-17",
      "round-18",
      "round-19",
      "round-20",
      "round-21",
      "round-22",
      "round-23",
      "round-24",
      "round-25",
      "round-26",
      "round-27",
      "round-28",
      "final"
    ],
    "controlPayloadSha256": "1111111111111111111111111111111111111111111111111111111111111111",
    "personaPayloadSha256": "2222222222222222222222222222222222222222222222222222222222222222",
    "effectiveInstructionsSha256": "3333333333333333333333333333333333333333333333333333333333333333",
    "roundArtifactsRetained": true
  },
  "runtime": {
    "surface": "synthetic-runtime",
    "model": "synthetic-model",
    "modelConfigurationSha256": "aaaaaaaaaaaaaaaaaaaaaaaaaaaaaaaaaaaaaaaaaaaaaaaaaaaaaaaaaaaaaaaa",
    "toolPolicySha256": "bbbbbbbbbbbbbbbbbbbbbbbbbbbbbbbbbbbbbbbbbbbbbbbbbbbbbbbbbbbbbbbb",
    "sameConfigurationAcrossArms": true,
    "timingMode": "counterbalanced-sequential",
    "launchOrder": "control-first",
    "actualModelRequestsAvailable": false
  },
  "persona": {
    "id": "synthetic-persona",
    "locale": "en",
    "intensity": "balanced",
    "format": "text",
    "compiledPromptSha256": "4444444444444444444444444444444444444444444444444444444444444444",
    "compiledPromptBytes": 5000
  },
  "arms": {
    "control": {
      "status": "complete",
      "executedStepIds": [
        "setup",
        "round-1",
        "round-2",
        "round-3",
        "round-4",
        "round-5",
        "round-6",
        "round-7",
        "round-8",
        "round-9",
        "round-10",
        "round-11",
        "round-12",
        "round-13",
        "round-14",
        "round-15",
        "round-16",
        "round-17",
        "round-18",
        "round-19",
        "round-20",
        "round-21",
        "round-22",
        "round-23",
        "round-24",
        "round-25",
        "round-26",
        "round-27",
        "round-28",
        "final"
      ],
      "roundArtifactSha256": "6666666666666666666666666666666666666666666666666666666666666666",
      "tokens": 100000,
      "elapsedSeconds": 900,
      "modelRequests": null,
      "taskQualityScore": 71,
      "taskQualityBreakdown": {
        "factual-accuracy-and-evidence": 29,
        "coverage-and-prioritization": 18,
        "actionable-usefulness": 14,
        "calibration-and-unsupported-claims": 10
      },
      "processErrors": 2,
      "selfCorrections": 1,
      "failureReason": null
    },
    "persona": {
      "status": "complete",
      "executedStepIds": [
        "setup",
        "round-1",
        "round-2",
        "round-3",
        "round-4",
        "round-5",
        "round-6",
        "round-7",
        "round-8",
        "round-9",
        "round-10",
        "round-11",
        "round-12",
        "round-13",
        "round-14",
        "round-15",
        "round-16",
        "round-17",
        "round-18",
        "round-19",
        "round-20",
        "round-21",
        "round-22",
        "round-23",
        "round-24",
        "round-25",
        "round-26",
        "round-27",
        "round-28",
        "final"
      ],
      "roundArtifactSha256": "7777777777777777777777777777777777777777777777777777777777777777",
      "tokens": 110000,
      "elapsedSeconds": 990,
      "modelRequests": null,
      "taskQualityScore": 74,
      "taskQualityBreakdown": {
        "factual-accuracy-and-evidence": 30,
        "coverage-and-prioritization": 19,
        "actionable-usefulness": 15,
        "calibration-and-unsupported-claims": 10
      },
      "processErrors": 4,
      "selfCorrections": 3,
      "failureReason": null
    }
  },
  "quality": {
    "labelBlinded": true,
    "rubricMaximum": 100,
    "rubric": [
      { "id": "factual-accuracy-and-evidence", "maximum": 40 },
      { "id": "coverage-and-prioritization", "maximum": 25 },
      { "id": "actionable-usefulness", "maximum": 20 },
      { "id": "calibration-and-unsupported-claims", "maximum": 15 }
    ],
    "nonInferiorityMargin": 3,
    "evaluatorModel": "synthetic-judge",
    "evaluatorPayloadSha256": "8888888888888888888888888888888888888888888888888888888888888888",
    "artifactSha256": "5555555555555555555555555555555555555555555555555555555555555555",
    "armMappingSha256": "9999999999999999999999999999999999999999999999999999999999999999"
  }
}
